{
  "Id": "myc_apexsymbiont",
  "TraitName": "Apex Symbiont",
  "Description": "Healing received +20%. Heal done +3. Symbiosis +2. Symbiosis keeps 75% of its charges when it jumps, instead of half.",
  "ActivateOnRuneTypeAdded": false,
  "TryActivateOnEveryEvent": false,
  "TimesPerTurn": 0,
  "TimesPerRound": 0,
  "TraitCard": "",
  "TraitCardForAllHeroes": "",
  "CharacterStatModified": "None",
  "CharacterStatModifiedValue": 0,
  "ResistModified1": "None",
  "ResistModifiedValue1": 0,
  "ResistModified2": "None",
  "ResistModifiedValue2": 0,
  "ResistModified3": "None",
  "ResistModifiedValue3": 0,
  "AuracurseImmune1": "",
  "AuracurseImmune2": "",
  "AuracurseImmune3": "",
  "AuracurseBonus1": "myc_symbiosis",
  "AuracurseBonusValue1": 2,
  "AuracurseBonus2": "",
  "AuracurseBonusValue2": 0,
  "AuracurseBonus3": "",
  "AuracurseBonusValue3": 0,
  "HealFlatBonus": 3,
  "HealPercentBonus": 0.0,
  "HealReceivedFlatBonus": 0,
  "HealReceivedPercentBonus": 20.0,
  "DamageBonusFlat": "None",
  "DamageBonusFlatValue": 0,
  "DamageBonusFlat2": "None",
  "DamageBonusFlatValue2": 0,
  "DamageBonusFlat3": "None",
  "DamageBonusFlatValue3": 0,
  "DamageBonusPercent": "None",
  "DamageBonusPercentValue": 0.0,
  "DamageBonusPercent2": "None",
  "DamageBonusPercentValue2": 0.0,
  "DamageBonusPercent3": "None",
  "DamageBonusPercentValue3": 0.0,
  "MaxBleedDamagePerTurn": -1,
  "HideTimesPerTurnText": false,
  "TraitCardDisplayOnly": false,
  "DamageFlatNecessaryAuraCurse": "",
  "DamageFlatNecessaryAuraCurseCharges": 0,
  "DamageBonusFlatPerAuraCurseStack": 0,
  "KeyNotes": [],
  "Activations": [
    "PreBeginCombat"
  ]
}