{
  "Id": "myc_caustictouch",
  "TraitName": "Caustic Touch",
  "Description": "Piercing and Shadow damage +10%. Your first hit each turn on an enemy with Spore Rot deals Shadow damage equal to half its Spore Rot.",
  "ActivateOnRuneTypeAdded": false,
  "TryActivateOnEveryEvent": false,
  "TimesPerTurn": 1,
  "TimesPerRound": 0,
  "TraitCard": "",
  "TraitCardForAllHeroes": "",
  "CharacterStatModified": "None",
  "CharacterStatModifiedValue": 0,
  "ResistModified1": "None",
  "ResistModifiedValue1": 0,
  "ResistModified2": "None",
  "ResistModifiedValue2": 0,
  "ResistModified3": "None",
  "ResistModifiedValue3": 0,
  "AuracurseImmune1": "",
  "AuracurseImmune2": "",
  "AuracurseImmune3": "",
  "AuracurseBonus1": "",
  "AuracurseBonusValue1": 0,
  "AuracurseBonus2": "",
  "AuracurseBonusValue2": 0,
  "AuracurseBonus3": "",
  "AuracurseBonusValue3": 0,
  "HealFlatBonus": 0,
  "HealPercentBonus": 0.0,
  "HealReceivedFlatBonus": 0,
  "HealReceivedPercentBonus": 0.0,
  "DamageBonusFlat": "None",
  "DamageBonusFlatValue": 0,
  "DamageBonusFlat2": "None",
  "DamageBonusFlatValue2": 0,
  "DamageBonusFlat3": "None",
  "DamageBonusFlatValue3": 0,
  "DamageBonusPercent": "Piercing",
  "DamageBonusPercentValue": 10.0,
  "DamageBonusPercent2": "Shadow",
  "DamageBonusPercentValue2": 10.0,
  "DamageBonusPercent3": "None",
  "DamageBonusPercentValue3": 0.0,
  "MaxBleedDamagePerTurn": -1,
  "HideTimesPerTurnText": false,
  "TraitCardDisplayOnly": false,
  "DamageFlatNecessaryAuraCurse": "",
  "DamageFlatNecessaryAuraCurseCharges": 0,
  "DamageBonusFlatPerAuraCurseStack": 0,
  "KeyNotes": [],
  "Activations": [
    "PreBeginCombat",
    "Hit"
  ]
}